{
  "schema_version": "1.0.0",
  "request_id": "toolreq_DescribeRuntime001",
  "tool_name": "describe_runtime_capabilities",
  "status": "ok",
  "completed_at": "2026-04-17T18:00:01Z",
  "result": {
    "runtime_capability_manifest": {
      "schema_version": "1.0.0",
      "manifest_id": "capmanifest_20260417B",
      "generated_at": "2026-04-17T18:00:00Z",
      "runtime_layer": "audio_runtime",
      "summary": "Published runtime capability surface for deterministic audio editing and Layer 1 effect processing in the current repository.",
      "limitations": [
        "Most operations currently support full_file targets only.",
        "time_stretch is runtime-available but not yet selected by the baseline planner.",
        "Stereo routing primitives are runtime-available but not yet selected by the baseline planner.",
        "Layer 1 ambience, texture, and modulation effects are runtime-available but not yet selected by the baseline planner."
      ],
      "operations": [
        {
          "name": "gain",
          "category": "level",
          "summary": "Apply explicit gain change in decibels.",
          "intent_support": "planner_supported",
          "supported_target_scopes": ["full_file"],
          "parameters": [
            {
              "name": "gain_db",
              "value_type": "number",
              "required": true,
              "description": "Gain adjustment in decibels.",
              "unit": "dB",
              "example_value": -1.5
            }
          ]
        },
        {
          "name": "pan",
          "category": "stereo",
          "summary": "Pan mono material into stereo or rebalance an existing stereo file.",
          "intent_support": "runtime_only",
          "supported_target_scopes": ["full_file"],
          "channel_requirements": {
            "min_channels": 1,
            "max_channels": 2
          },
          "constraints": ["Requires mono or stereo input in the current runtime."],
          "planner_notes": ["Runtime-available but not yet chosen by the baseline planner."],
          "parameters": [
            {
              "name": "position",
              "value_type": "number",
              "required": true,
              "description": "Pan position from left -1 to right +1.",
              "minimum": -1,
              "maximum": 1,
              "example_value": 0.35
            }
          ]
        },
        {
          "name": "reverb",
          "category": "effects",
          "summary": "Apply a layered echo-based reverb with explicit pre-delay, spacing, tap count, and decay.",
          "intent_support": "runtime_only",
          "supported_target_scopes": ["full_file"],
          "planner_notes": [
            "Runtime-available Layer 1 effect. Not yet chosen by the baseline planner."
          ],
          "parameters": [
            {
              "name": "pre_delay_ms",
              "value_type": "number",
              "required": true,
              "description": "Delay before the first reverb reflection.",
              "minimum": 1,
              "maximum": 250,
              "unit": "ms",
              "example_value": 12
            },
            {
              "name": "reflection_spacing_ms",
              "value_type": "number",
              "required": true,
              "description": "Spacing between successive synthetic reflection taps.",
              "minimum": 1,
              "maximum": 250,
              "unit": "ms",
              "example_value": 18
            }
          ]
        }
      ]
    }
  }
}
